{
  "manifest_version": 1,
  "id": "de.destination-one.export.tdh",
  "name": "TDH-XML",
  "version": "1.0.1",
  "kind": "export_format",
  "runtime": "builtin",
  "builtin": "xml_tdh",
  "summary": "Ausgabe im XML-Format des Tourismus-Datenhubs (Legacy-Schnittstelle).",
  "publisher": {
    "name": "destination.one GmbH",
    "url": "https://www.destination.one",
    "email": "info@destination.one"
  },
  "license": "MIT",
  "requires": {
    "onedata": ">=1.35"
  },
  "categories": [
    "export",
    "xml",
    "legacy"
  ],
  "data_egress": false
}
