{
  "manifest_version": 1,
  "id": "de.destination-one.import.tdh",
  "name": "Tourismus-Datenhub TDH (XML)",
  "version": "1.0.3",
  "kind": "import_format",
  "runtime": "declarative",
  "summary": "Migration aus dem Tourismus-Datenhub: XML-Exportdateien (Element item) übernehmen.",
  "publisher": {
    "name": "destination.one GmbH",
    "url": "https://www.destination.one",
    "email": "info@destination.one"
  },
  "license": "MIT",
  "requires": {
    "onedata": ">=1.35"
  },
  "categories": [
    "migration",
    "xml"
  ],
  "data_egress": false,
  "import": {
    "parser": "xml",
    "source_system": "tdh",
    "options": {
      "record_element": "item",
      "id_path": "@id",
      "type_path": "@type"
    },
    "hint": "Exportdatei aus dem TDH hochladen",
    "accept": ".xml,application/xml"
  }
}
