{
  "manifest_version": 1,
  "id": "de.destination-one.connector.n8n",
  "name": "n8n / Push-Eingang",
  "version": "1.0.3",
  "kind": "connector",
  "runtime": "declarative",
  "summary": "Beliebige Daten über einen n8n-Flow per Push-Eingang liefern.",
  "publisher": {
    "name": "destination.one GmbH",
    "url": "https://www.destination.one",
    "email": "info@destination.one"
  },
  "license": "MIT",
  "requires": {
    "onedata": ">=1.35"
  },
  "categories": [
    "konnektor",
    "push"
  ],
  "data_egress": false,
  "connector": {
    "base_kind": "push",
    "source_system": "n8n",
    "config": {},
    "hint": "Ingest-Token erzeugen und im n8n-HTTP-Knoten verwenden"
  }
}
